id,adult,budget,genres,original_title,overview,popularity,poster_path,release_date,revenue,runtime,tagline,title,actor_1,actor_2,actor_3,director,file_path_1,file_path_2,file_path_3
207,N/A,19000000,14,千と千尋の神隠し,평범한 열 살 짜리 소녀 치히로 식구는 이사 가던 중 길을 잘못 들어 낡은 터널을 지나가게 된다. 터널 저편엔 폐허가 된 놀이공원이 있었고 그곳엔 이상한 기운이 흘렀다. 인기척 하나 없는 이 마을의 낯선 분위기에 불길한 기운을 느낀 치히로는 부모님에게 돌아가자고 조르지만 부모님은 호기심에 들떠 마을 곳곳을 돌아다니기 시작한다. 어느 음식점에 도착한 치히로의 부모님은 그 곳에 차려진 음식들을 보고 즐거워하며 허겁지겁 먹어대다가 돼지로 변해버린다. 겁에 질려 당황하는 치히로에게 낯선 소년 하쿠가 나타나 빨리 이곳을 나가라고 소리치는데...,29.849,/mD49waY0XR7HNrS13r63tfgYT08.jpg,2001-07-20,274925095,124,금지된 세계의 문이 열렸다,센과 치히로의 행방불명,19587,19588,19589,Hayao Miyazaki,/mnpRKVSXBX6jb56nabvmGKA0Wig.jpg,/djgM2d3e42p9GFQObg6lwK2SVw2.jpg,/pmYrjNjtHTCyXuAHmO7Z3pBwti0.jpg
208,N/A,14000000,10751,The Great Mouse Detective,"1897년 영국 런던에서 올리비아라는 쥐 소녀가 생일을 맞았는데 그녀의 아버지가 유괴당했다. 올리비아는 아버지를 찾아줄 사람을 찾다가 군 복무에서 돌아온 데이빗 도슨 박사와 만나고, 둘은 바실에게 도움을 요청하는데, 이야기를 들은 바실은 라티건 교수가 벌인 일이 틀림없다고 한다. 그는 올리비아와 도슨 그리고 개 토비와 함께 라티건을 추적하기 시작한다. 그러나 도중에 올리비아는 라티건에게 납치당하고...",25.724,/9uDr7vfjCFr39KGCcqrk44Cg7fQ.jpg,1986-07-02,38625550,74,N/A,위대한 명탐정 바실,39949,61674,1905,Ron Clements,/A0enTetqBfL3UqLPyg0MONLQDXN.jpg,/gGumeXIg1qiikh54ABq7Pta9DkH.jpg,/vbXxvXcWWFd4l3gRBhhyssykpjM.jpg
209,N/A,10000000,53,Byzantium,"영화 '비잔티움'은 '뱀파이어와의 인터뷰'의 닐 조던 감독이 연출한 또 하나의 뱀파이어 스토리로, 젬마 아터튼과 시얼샤 로넌이 200여 년을 살아온 뱀파이어 모녀로 등장한다.",25.48,/pSnlpdh27luQ6GcchSkPomZ5fyr.jpg,2012-09-09,89237,118,N/A,비잔티움,36592,59620,32987,Neil Jordan,/7ujUCqM0aFZfKqpZN4O5Zh2Q4ei.jpg,/pGFl5jGYlbT5AaQ34iC9yEuuiMm.jpg,/qPNOa138rdAWWOR2TOYmiTPTDfy.jpg
210,N/A,34000000,53,The Maze Runner,"삭제된 기억, 거대한 미로로 둘러싸인 낯선 공간  모든 기억이 삭제된 채 의문의 장소로 보내진 ‘토마스’(딜런 오브라이언).  ‘토마스’는 미로에 갇힌 그곳에서 자신과 같은 상황의 사람들을 만난다.  그들은 매일 밤 살아 움직이는 미로에서 정체를 알 수 없는 죽음의 존재와 대립하며,  지옥으로부터 빠져나갈 탈출구인 지도를 완성해 나간다.  그러던 어느 날, 미로의 문이 열리고 그들은 마지막 선택의 기로에 놓이게 되는데…",32.453,/h72Qgg8nzvy6ZtNPntB17DUHvw8.jpg,2014-09-10,348300000,113,살아 남기 위해서는 뛰어야 한다!,메이즈 러너,527393,115150,1310760,Wes Ball,/lkOZcsXcOLZYeJ2YxJd3vSldvU4.jpg,/tHZEKGITcgEQrNWGeqJlzpDdzLf.jpg,/tNBTdisQ5OmvJU0OF87xrZbgGXO.jpg
211,N/A,178000000,14,X-Men: Apocalypse,"고대 이집트에서 신으로 숭배받았던 최초의 돌연변이 아포칼립스(오스카 아이삭)가 오랜 잠에서 깨어난다. 초능력을 흡수해가며 수천년을 살아온 아포칼립스는 스톰(알렉산드라 십), 사일록(올리비아 문), 아크엔젤(벤 하디) 그리고 매그니토에게 자신의 힘을 나누어준 뒤, 그들과 함께 현재의 세상을 뒤엎고 새로운 세상을 건설하려 한다. 찰스 자비에(제임스 맥어보이)와 미스틱은 아포칼립스의 지구 종말 계획을 알아채고, 진 그레이(소피 터너), 사이클롭스(타이 셰리던), 퀵 실버(에반 피터스), 나이트크롤러(코디 스밋 맥피) 등 젊은 돌연변이들과 함께 아포칼립스에 대항한다.",31.334,/lQEDt8hAuYCliCXDP6plhqC7KET.jpg,2016-05-18,543934787,145,강한 자만이 살아남을 것이다,엑스맨: 아포칼립스,5530,17288,72129,Grant Major,/oQWWth5AOtbWG9o8SCAviGcADed.jpg,/kBPzQu7kgpJFw6aJwcWnsh3uXZO.jpg,/2fJ7LFeJ03S5g5Li2RS8k9cF2dr.jpg
212,N/A,28000000,35,"Alexander and the Terrible, Horrible, No Good, Very Bad Day","자신이 생각했을 떼 매일 운수가 나쁜 알렉산더 하루 하루 힘들게 치이면서 재내고 있다.그러나 아버지 벤, 어머니 켈리, 형 안토니, 그리고 누나 에밀리는 좋은 일만 생겨 알렉산더의 고통을 이해하지 못한다. 그러던 어느날 알렉산더는 생일날 혼자 소원을 비는데, 그 소원은 바로 가족들 모두 하루종일 불행하게 해달라는 것이다.  관연 그 소원이 정말 이루어질 수 있을지? 가족들의 엄청난 수난기",22.425,/yup7xOCpOSHeUyalUH6mpFuBDpG.jpg,2014-10-08,100654149,81,Alexander And The Terrible  Horrible  No Good  Very Bad Day,난 지구 반대편 나라로 가버릴테야,1198286,4495,9278,Miguel Arteta,/z5e275a7iDNCQNx0NelsX5LYmDU.jpg,/3XOqAPpApaxvjsQ4f87R039sEd5.jpg,/eNJ2IYK6aBreB3UbYTXKn65m5lw.jpg
213,N/A,4000000,27,The Return of the Living Dead,"1984년 7월 3일, 유니다(Uneeda) 의료용품 공급업체에 갓 취업한 프레디는 이곳에서 오랫동안 일해온 프랭크에게 여러가지 시체들에 얽힌 믿을 수 없는 괴상한 이야기를 듣는다. 15여 년 전인 1969년 피츠버그 재향군인 병원에서 화학 물질이 땅 속에 흘러들어 시체들이 깨어일어난다. 그 화학 물질은 데럴 화학이 미군을 위해 개발 중이었던 약품인데 오염된 시체들을 파내고 극비에 붙여 사건을 수습했다고 한다. 그런데 수송국의 착오로 시체들을 데럴사가 아닌 유니다로 가져왔다는 이야기였다. 그러면서 믿기지 않는 표정의 프레드를 지하실로 데려가 직접 살아있는 시체를 보여준다",24.315,/1vydUitzC8W8W5oNevEArCltydJ.jpg,1985-05-15,14237880,88,그들이 무덤에서 돌아왔다. 그리고 파티가 시작된다.,바탈리언,62019,14852,41262,Dan O'Bannon,/jA34vdJCxOZUoi4khkfhq1pX3WG.jpg,/e818nytryinpgy4r4OkObYdiq00.jpg,/flJlT7e4DIRUK5i7D5BZcHpLy9m.jpg
214,N/A,34000000,53,The Darkest Minds,갑자기 10대 아이들에게 초능력이 생기자 살아남은 이를 두려워한 정부는 아이들을 수용소에 수감한다. 그러나 그 중에서 가장 강력한 능력을 지닌 소녀 ‘루비’는 수용소를 탈출하고 살아남은 아이들을 만나게 되면서 각자가 지닌 초능력의 힘으로 새로운 삶을 찾고자 한다.,22.376,/94RaS52zmsqaiAe1TG20pdbJCZr.jpg,2018-08-02,41142379,105,미래 사회에서 초능력 아이들의 사투를 그린 판타스틱 공상과학 영화,다키스트 마인드,561869,1716493,1379407,Jennifer Yuh Nelson,/5BxrMNGl3YDiWgHCVJu8iLQoJDM.jpg,/rPBeEi1tU8IhQ9rbdnlLU0d0NR.jpg,/2r2SVIOZBGQqtwyUEnaASWWwtEG.jpg
215,N/A,N/A,27,Crypto,N/A,22.818,N/A,2018-11-25,N/A,N/A,N/A,Crypto,N/A,N/A,N/A,Clint Cure,N/A,N/A,N/A
216,N/A,4000000,10749,Flashdance,18세의 소녀 알렉산드라(제니퍼 빌즈)는 복잡한 대도시 피츠버그의 제철 공장에서 용접공으로 일한다. 알렉산드라는 밤에는 나이트클럽의 플로어 댄서로 일하면서도 댄서로서의 자신의 꿈을 키워나간다. 알렉산드라는 무용으로 일가를 이루려는 꿈을 가진 소녀이다. 그런데 회사 사장 닉(마이클 노리)이 그녀의 꿈과 능력을 알아보고 그 꿈을 실현시켜 줄 것을 결심한다. 이에 닉은 물심양면으로 알렉스를 도와준다. 그러는 동안 닉과 알렉산드라의 관계는 사랑하는 사이로 발전해 나간다. 그리고 열심히 노력한 결과 알렉산드라는 자신의 능력을 인정받아 꿈을 이루게 된다.,24.459,/jwsnPftPybX2pTDbvWbyqviKO7S.jpg,1983-04-14,92921203,95,N/A,플래시댄스,3130,8699,31114,Adrian Lyne,/4j8ZD5SyKCaPh2xhkE23ricTMCH.jpg,/fqWASO0xaB5ermhcCZQQQxTOeVn.jpg,/js7SQnzxmLtnCKpOIGcs2bWxvdS.jpg
217,N/A,N/A,36,On the Basis of Sex,"남녀 차별이 당연시되던 시대에 태어난 ‘긴즈버그’는 1950년대 하버드대학교 로스쿨에서 남자들의 자리를 뺏은 9명의 여학생 중 한 명으로서 수석졸업을 하고 두 아이를 키우며 법대 교수가 된다. 그리고 1970년대, 차별의 완벽한 조건을 가진 여성 변호사로서 우연히 남성 보육자와 관련된 사건을 접하게 된다. 긴즈버그는 이것이 남성의 역차별 사건이며 성차별의 근원을 무너뜨릴 수 있는, 50년 전쟁의 포문을 열 열쇠임을 직감한다. 모두가 도저히 이길 수 없는 싸움, 패배가 확정된 재판이라 말렸지만, 긴즈버그는 남편과 딸의 지지에 힘입어 178건의 합법적 차별을 무너뜨릴 세기의 재판에 나서는데…",27.285,/xAGqNhB6QY12Y1LxqhcrXvQ7LYN.jpg,2018-12-25,N/A,120,"세상을 바꿀 위대한 용기, 모두의 평등을 위한 결정적 반전이 시작된다!",세상을 바꾼 변호인,72855,53807,15009,Daniel Stiepleman,/3lZuky17k1ihovh6mvFyGfgLIi4.jpg,/uSP1EqGc2aH5Wz0aQahEWkCgUMK.jpg,/rnv37aPjOMXyfQdXi1gwLW0QY7g.jpg
218,N/A,200000000,53,Titanic,17세기 엄격한 사회 질서에 숨막혀 하는 미국 상류층 로즈(케이트 윈슬렛)는 사교계의 굴레에서 벗어나지 못하는 어머니와 권위적인 재벌 귀족 약혼자와 함께 미국으로 향하는 타이타닉호 1등실에 승선한다. 부두의 선술집에서 도박으로 운 좋게 타이타닉호의 3등실 티켓을 얻은 가난한 화가 잭(레오나르도 디카프리오) 역시 아슬아슬하게 배에 승선한다. 첫 눈에 로즈에게 반한 잭은 갑판에서 바다로 몸을 던지려 하는 로즈를 발견하고 재치 있는 언변과 행동으로 그녀의 생명을 구한다. 이 사건을 계기로 1등실의 저녁식사에 초대받게 되고 서로에게 끌리는 자신들을 발견한다.,30.756,/p0L1f5YRiUmbExUTn5VbFQtxfpN.jpg,1997-11-18,1845034188,194,차가운 바닷물 속에 잠든 러브 스토리,타이타닉,204,6193,1954,James Cameron,/xqQztbT6KlPLQLlRtNHoXivEMZA.jpg,/vFUI5obFtx4IdhP6k8Om5ezHTrk.jpg,/2Te2YJoLtT2cHME7i5kDuEwJWZc.jpg
219,N/A,14000000,35,Hot Tub Time Machine 2,"핫 텁 타임머신의 남자들이 더 거칠고 선정적인 모험을 위해 1편보다 더 재미있게 돌아왔다! 완벽했던 파티가 우스꽝스럽게 돌아가게 되면서, 닉(크레이그 로빈슨) 과 제이콥(클락 듀크)은 루(롭 코드리)를 구하기 위해 핫텁을 작동시키게 된다. 예기치 않게 2025년에 도착해버린 그들은 아담 주니어(아담 스캇)를 만나 현재를 바로잡기 위해 엄청나게 웃기고 완전히 미친것 같은 일들을 함께 해나간다",23.863,/tQtWuwvMf0hCc2QR2tkolwl7c3c.jpg,2015-02-20,12314651,93,N/A,핫 텁 타임머신 2,52997,64342,54729,Kelly Cantley,/e2au5ZOOxThV3mB6Wu0fK8OFqpq.jpg,/wuPC7NqTgQZWXVrALvNWZCn8YJY.jpg,/7WRb2V3rcChPG6HhXgpZltphz3t.jpg
220,N/A,14000000,36,Suffragette,"1912년 영국에서는 여성들에게 투표권을 보장하라고 외치는 여성 참정권 운동가들의 목소리가 거세지고 있었다. 그들의 구심점인 여성사회정치동맹(WSPU)은 런던에 위치해 있었다. 세탁공장 노동자인 모드 와츠(캐리 멀리건)는 한 남자의 아내, 한 아이의 엄마로서의 자신의 삶을 의심해본 적 없는 하루하루를 살아간다. 여성 투표권을 주장하며 거리에서 투쟁하는 서프러제트 무리를 목격한 그날도 그들이 바꿀 수 있는 것은 아무 것도 없을 거라 생각했던 그녀. 하지만 여성이라는 이름 앞에 무너져버린 정의와 인권 유린의 세태에 분노하게 되고 부당함에 맞서기 위해 거리로 발걸음을 옮기게 되는데...",23.615,/6oqe2yphhsGk5ki41fhksLcgVzF.jpg,2015-10-16,16002420,106,역사를 바꾼 여인들의 용기 있는 선택,서프러제트,36662,1283,2039,Sarah Gavron,/o8I5TrjyuiYuRd4J7pIyFQNU6Q1.jpg,/xZ0PYNFGoIFYVlyldZaj7Kqvgrx.jpg,/ahfgyQt8K8pHROht4Bk9HOgbMy0.jpg
221,N/A,18000000,18,Labor Day,동명소설을 원작으로 싱글맘과 탈옥수의 사랑이야기를 그린 작품으로 케이트 윈슬렛과 조쉬 브롤린이 주연을 맡았다.,20.959,/4TKMiTqZnG6KJWjmxy2ZCDuG3M0.jpg,2013-12-27,20275812,111,N/A,레이버 데이,16851,204,117885,Jason Reitman,/rW6RcTt45MjqpXFZokdPvAQRGKk.jpg,/etWGD7y6SewUFDJHz4uTbFIOCBT.jpg,/sninDLeRx9xtLozHvjQwkVIX4DP.jpg
222,N/A,18000000,35,Birdman,"슈퍼히어로 버드맨으로 할리우드 톱 스타에 올랐지만 지금은 잊혀진 배우 리건 톰슨(마이클 키튼). 그는 꿈과 명성을 되찾기 위해 브로드웨이 무대에 도전한다. 대중과 멀어지고, 작품으로 인정받은 적 없는 배우에게 현실은 그의 이상과 거리가 멀다. 재기에 대한 강박과 심각한 자금 압박 속에, 평단이 사랑하는 주연배우(에드워드 노튼)의 통제불가 행동들, 무명배우의 불안감(나오미 왓츠), SNS 계정 하나 없는 아빠의 도전에 냉소적인 매니저 딸(엠마 스톤), 연극계를 좌지우지 하는 평론가의 악평 예고까지... 과연 버드맨 리건은 다시 날아오를 수 있을까?",32.479,/4T7mkPn1OVcA92awXPqOc6dQzqO.jpg,2014-08-27,103215094,119,화려한 스포트라이트에 가려진 슈퍼히어로의 진짜 모습,버드맨,2232,819,54693,Stephen Mirrione,/AsJVim0Hk3KbQPbfjyijfjqmaoZ.jpg,/5tDErYQ8Ne1N6dNAlxg8yYNUwRA.jpg,/yx0NtxSeh0ko7qwAu676EU7qsd5.jpg
223,N/A,245000000,14,Star Wars: The Force Awakens,"2번째 데스 스타가 파괴되고 다스 베이더가 사망한 지 약 30년 후,  마지막 남은 제다이인 루크 스카이워커가 사라졌다. 몰락한 은하 제국으로부터 일어난 퍼스트 오더는 루크와 공화국을 찾아내 제거하려 한다. 공화국과 루크의 쌍둥이 여동생 레이아 오르가나가 이끄는 저항군은 퍼스트 오더를 저지하고 루크의 도움을 받기 위해 루크를 찾는다. 저항군 최고의 파일럿 포 다메론은 자쿠 행성의 마을 장로를 만나 루크가 있는 장소의 지도를 얻는다. 카일로 렌이 이끄는 스톰트루퍼들은 마을을 파괴하고 포를 붙잡지만, 포의 드로이드 BB-8는 지도를 갖고 탈출하고 부랑자 레이를 만나게 된다.",41.391,/eOD7WQULbncPmiETBPmvDxBCpKY.jpg,2015-12-15,2068223624,135,새로운 전설이 시작된다,스타워즈: 깨어난 포스,1315036,236695,3,J.J. Abrams,/njv65RTipNSTozFLuF85jL0bcQe.jpg,/c2Ax8Rox5g6CneChwy1gmu4UbSb.jpg,/wSyHVm2rv9jHxBqjAfSXJGSAYJ9.jpg
224,N/A,62000000,80,The Equalizer 2,전직 특수 요원 로버트 맥콜(덴젤 워싱턴)이 정의를 구현하기 위해 악행을 일삼는 범죄 집단을 소탕하는 덴젤 워싱턴의 숨막히는 범죄 액션 스릴러.,32.641,/hkhkq5UlxNE57uRrdTz7yIwef2v.jpg,2018-07-19,102084362,122,N/A,더 이퀄라이저 2,5292,1253360,1152019,Richard Lindheim,/a24i4Qw6qFTtkFLQsncv8WPwevj.jpg,/z7noaCJ4KtmhwHw7QcNtnMMo4Qy.jpg,/yonslm3ahbmY1egZOOsaBhBfW51.jpg
225,N/A,25000000,10751,Teenage Mutant Ninja Turtles II: The Secret of the Ooze,"에이프릴의 방송을 보던 중, 거북이들은 자신들이 태어나게 된 원인에 대해서 알 수 있는 단서를 얻는다. 그리고 거북이들은 사부인 스플린터의 말에 따라 그것의 원인이 되었던 TGRI를 찾아가 그 물질을 손에 넣으려 하지만 실패하고, 자신들의 근원에 대해 알 수 있는 것을 놓쳐 낙심하게 된다. 그러던 중 피자배달부인 케노 덕분에 더 풋의 본거지를 알게 되고 그곳을 찾아가는 데, 그곳에서 생각지도 못한 인물을 만나게 되는데...",27.13,/jXlXV8MNaJdsGaImYI4FjciX6sP.jpg,1991-03-22,78000000,88,진짜 영웅 닌자터틀 4총사와 함께 화끈하게 놀아보자!,어메이징 닌자,74932,2076,77152,Michael Pressman,/mrO3Nn8BWNWiu6Ql76KM7Fx7vMv.jpg,/kcBgrUeBjtDCEUcRfO9JfMtQ6BQ.jpg,/yopjxaXpm1lnWIY9OHyZZ5Fa0l3.jpg
226,N/A,8500000,80,Welcome to the Punch,"열혈형사 맥스(제임스 맥어보이)는 거물급 범죄자 제이콥(마크 스트롱)을 붙잡으려다 치명적인 총상을 입은 뼈아픈 과거가 있다.수년 후, 강도사건에 연루된 아들을 구하기 위해 해외에 은신해 있던 제이콥이 런던으로 돌아온다.미치도록 잡고 싶었던 적수 제이콥의 컴백은 맥스에게 있어 놓칠 수 없는 절호의 기회!쫓고 쫓기는 충돌과 대결이 이어지는 가운데, 맥스와 제이콥은 도시의 시스템 안에 존재하는 공통의 함정 속에 빠졌다는 것을 깨닫게 되는데…미치도록 잡고 싶은 적과 같은 함정에 빠진 형사 맥스에게 주어진 미션!끝까지 살아남아서 진짜 적을 찾아내라!",23.336,/eJwSM618opISwPkzia9fNeFvW4Z.jpg,2013-03-15,9747,107,"매 순간 적이 바뀐다! 놈도, 진짜 적도 한꺼번에 끝내버린다!",테이크다운,5530,2983,18616,Eran Creevy,/ncd51Nzk7a6DJKpD5FIMx9iRbWY.jpg,/f17LoYwDtNIuWVBiP1sTN6uhKfe.jpg,/8H21Fq1iki6xNIUFjZQJilvIzxC.jpg
227,N/A,N/A,10749,言の葉の庭,구두 디자이너를 꿈꾸는 고등학생 다카오는 비오는 날 오전에는 학교 수업을 빼먹고 도심의 정원으로 구두 스케치를 하러 간다. 어느 날 그는 우연히 유키노라는 여인과 정원에서 만나게 된다. 그녀는 그보다 연상으로 보이지만 세상과 동떨어진 듯한 삶을 살고 있는 여인. 나이 차이가 나는 그들의 예상치 못한 우연한 만남은 비가 오는 날이면 그 정원에서 계속 이어진다. 이름도 나이도 알지 못하지만 걷는 법을 잊어버린 그녀를 위해 다카오는 구두를 만들어 주기로 결심한다. 하지만 장마가 끝나갈 무렵 그들 사이에는 뭔가 말하지 못한 것들이 남아 있는데...  과연 다카오는 그의 감정을 행동이나 말로 옮길 수 있을까?,24.885,/1iGGkHavKUYuxbEjtoTTeWTfMGJ.jpg,2013-05-31,N/A,46,"사랑, 그 이전의 사랑 이야기",언어의 정원,19588,119143,129960,Makoto Shinkai,/k63K2HWcTZtGDl8QsJqZaDIqpuE.jpg,/stwZwqHj188gCeZ2VmXQxaFr9zg.jpg,/hVAV6dscURKcCxDOlgalhvtypBF.jpg
228,N/A,N/A,36,The Dirt,"음악은 위대했고, 삶은 난잡했다. 전설의 밴드 머틀리 크루의 파격적 자서전을 영화로 만난다. LA의 악동에서 록의 전설로, 그 불꽃같은 삶과 무대가 생생히 되살아난다.",22.467,/xGY5rr8441ib0lT9mtHZn7e8Aay.jpg,2019-03-22,N/A,108,N/A,더 더트,230680,1276759,221978,Jeff Tremaine,/lFLwxSd9JReOBBxoUwQFBANcyIl.jpg,/hslCBzXxCOJW12MBlr2lGyU5gmQ.jpg,/z7lEs4K3CJ5PvwDbKrL44YNP0PX.jpg
229,N/A,120000000,14,Rampage,"유인원 전문가 ‘데이비스(드웨인 존슨)’는 사람들은 멀리하지만, 어릴 때 구조해서 보살펴 온 영리한 알비노 고릴라 ‘조지’와는 특별한 감정을 공유한다. 어느 날, 유순하기만 하던 조지가 의문의 가스를 흡입하면서 엄청난 괴수로 변해 광란을 벌인다. 재벌기업이 우주에서 무단으로 감행한 ‘프로젝트 램페이지’라는 유전자 조작 실험이 잘못되면서 지구로 3개의 병원체가 추락했던 것. 조지뿐만 아니라 가스를 마신 늑대와 악어 역시 변이시키고 끝도 없이 거대해진 이들 포식자들이 도심을 파괴하며 미국 전역을 쑥대밭으로 만들어 놓는다. 데이비스는 괴수들을 상대로 전지구적인 재앙을 막고 변해버린 조지를 구하기 위한 해독제를 찾아야만 하는데…",29.071,/6m0mn0SpL98Er6Y2MdC63zR64d2.jpg,2018-04-12,426245950,107,초거대 괴수들이 미쳐 날뛴다!,램페이지,18918,2038,50463,Brad Peyton,/wrqUiMXttHE4UBFMhLHlN601MZh.jpg,/e3jCOFC14wC0VKMUHuIA9IfeALs.jpg,/5wJf9JOoY3kpUyWzPvdL8QPgdeu.jpg
230,N/A,8000000,10749,En kongelig affære,"절대왕정이 무르익던 18세기 덴마크. 편집증을 앓고 있는 왕 크리스티안7세를 치료하기 위해 고용된 독일인 의사 요한은 뛰어난 언변과 어린 왕과 왕비를 감싸주는 포용력으로 그들의 신임을 얻어 나랏일에 참여를 하게 된다. 시대에 걸맞지 않은 자유로운 사상과 파격적인 개혁법안으로 귀족들의 견제를 받게 되지만 그런 자유로운 사상이 왕비 캐롤라인의 생각과도 맞닿아 둘은 점점 가까워지며, 급기야는 비밀스러운 만남을 갖게 된다. 자신들의 이익에 침해하는 법안을 제안하는 요한을 못마땅하게 본 귀족들에 의해 둘의 스캔들이 발각 되고 결국 요한은 재판에 회부된다.",24.08,/61PCzC3vziFo8ohrddkzOz3Vtcq.jpg,2012-03-29,7594693,137,세상을 뒤흔든 치명적인 왕실비화,로얄 어페어,1019,227454,1013156,Nikolaj Arcel,/qSQkbVA5ONIKudSZVGsXGo9BPVK.jpg,/qUMDvACSfDEhqwLa3ZnHlbLOim1.jpg,/AmHZs39FuUc52tX40xeLvrnprJI.jpg
231,N/A,100,9648,Catarina e os Outros,N/A,36.069,/kZMCbp0o46Tsg43omSHNHJKNTx9.jpg,2011-03-01,N/A,15,N/A,Catarina and the others,1033632,1339554,1339555,André Badalo,N/A,N/A,N/A
232,N/A,1012153,36,No Man's Land,"한치 앞도 보이지 않는 짙푸른 안개를 뚫고 ‘치키’를 비롯한 보스니아 순찰대가 걸어온다. 세르비아군의 사정거리에 들어섰을지도 모른다는 생각에 그들은 가던 길을 멈추고 잠시 잠이 드는데...  눈을 뜨자마자 햇살 너머로 쏟아지는 세르비아군의 총격세례. 순찰대는 순식간에 몰살당하고, ‘치키’는 가슴에 부상을 입은 채 참호로 들어간다. 한편, 세르비아군인 신참 ‘니노’는 상사와 함께 참호를 살피러 들어온다. 생존자가 있는지 확인하기 위해 둘러보던 그들은 잠들어있던 치키의 동료 ‘체라’를 발견한 후 그의 등 밑에 지뢰를 설치한다. 발을 떼는 순간 2천개의 납조각이 튀어나와 모든 걸 파괴해버리는...  이를 몰래 숨어서 지켜보던 보스니아 군인 ‘치키’는 그들이 한 눈 파는 사이, 총을 겨눈다. 상사 1명은 죽고, ‘니노’는 치키의 포로가 된다. 서로를 탓하며 적의감에 불탄 것도 잠시, 체라가 잠에서 깨어나면서 지뢰의 위험성은 더해가고... 결국 두 사람은 팬티만 입은 채 수건을 흔들며 양쪽 진영에 구조를 요청한다. 그러나 어느쪽도 섣불리 접근을 피하는데... 결국 UN군이 구조를 위해 참호에 도착하지만, 상부는 그들에게 곧바로 철수할 것을 명령한다. 그들은 치키와 니노에게 동행할 것을 제안하지만, 체라를 남겨두고 떠날 수 없는 치키. 니노가 그들을 따라가려 하자, 치키는 그에게 총을 쏜다. UN군이 떠난 후 다시 적대감과 증오에 휩싸인 두 사람. 곧, UN군은 특종을 잡아내려는 기자단과 함께 지뢰제거군인을 데리고 다시 참호를 찾는다. 그러나 지뢰는 제거되지 않고, UN군과 기자단이 정신없는 사이, 꼼짝않고 누워서 어쩌면 죽을 날만 기다려야 하는 보스니아군인 ‘체라’는 참호 밖에서 울리는 슬픈 총성을 듣는데..",22.675,/dWBIY4hrBPQQKtQHdIv28wIEebu.jpg,2001-09-08,N/A,98,살짝만 건드려도 터져버리는 웃음의 지뢰밭!  안 올 거야? 죽으란 거야?  지뢰 위 세 남자의 생방송 구조작전,노 맨스 랜드,54620,54621,54622,Danis Tanović,/rvqeMX1HONJ2v7g3leaHtxSXBRZ.jpg,/j4ebFl6vSg3PCAxIOObGzd85pec.jpg,/khhLTaUtMaIUn2XbE5yNwB0IIoN.jpg
233,N/A,35000000,53,Sicario: Day of the Soldado,멕시코 마약 카르텔이 마약 대신 새로운 사업 모델인 불법 밀입국에 집중하면서 또 다른 문제가 불거진다. 불법 밀입국자들 속에 테러리스트들이 섞여 들어와서 폭탄 테러를 자행하자 미국은 전면전을 개시한다. 명령을 하달받은 CIA 작전 책임자 맷(조시 브롤린)은 알레한드로(베니치오 델 토로)와 함께 마약 카르텔끼리 전쟁을 붙이고자 한다. 가족의 복수를 위해 다시 칼을 빼든 알레한드로는 카르텔 보스 레예스의 딸 이사벨라(이사벨라 모너)를 납치해 경쟁 카르텔 한복판에 떨어뜨리려 하지만 작전이 꼬이면서 위기에 처한다.,29.455,/wLRW5G2WbXYrZiy2Q89eAVAOCli.jpg,2018-06-27,75836683,123,목표를 위해서 모든 것을 버린 작전 개시,시카리오: 데이 오브 솔다도,1121,16851,1428070,Taylor Sheridan,/tnwMCH4yLBY4qpe6Nr4n66u4U3f.jpg,/5vlYaha6IpsTOUIPZExO7Ruvzyn.jpg,/qgyEox920Bv3tE9PsVbOzeHrXf4.jpg
