id,adult,budget,genres,original_title,overview,popularity,poster_path,release_date,revenue,runtime,tagline,title,actor_1,actor_2,actor_3,director,file_path_1,file_path_2,file_path_3
133,N/A,165000000,35,Big Hero 6,"천재 공학도 ‘테디’가 개발한 힐링로봇 ‘베이맥스’!  ‘테디’의 동생이자 로봇 전문가인 ‘히로’는 도시가 파괴될 위기에 처하자
 ‘베이맥스’를 슈퍼히어로로 업그레이드 하는데…
 과연 이들은 도시의 위험을 막아낼 수 있을까?",34.574,/e6SgvKJkz4mNk2k1H4c1AYF2h1z.jpg,2014-10-24,657818612,102,"천재 형제, 가장 사랑스러운 슈퍼히어로를 만들다",빅 히어로,66580,515510,82093,Don Hall,/2BXd0t9JdVqCp9sKf6kzMkr7QjB.jpg,/lv3NrraY2VRK6ImwNU3vfOPZyTi.jpg,/9YefCrdvh3HqO4RqH4NHX21NxzN.jpg
134,N/A,N/A,80,Salò o le 120 giornate di Sodoma,"제 3 제국의 운명이 끝을 향해가고 있을 무렵, 타락한 이탈리아 귀족들 네 사람이 성욕을 마음껏 분출할 수 있는 천국을 만들기로 합의한다. 악명이 자자한 뚜쟁이 네 사람을 확보한 뒤 나치군인 몇 사람을 끌어 모은다. 이 타락한 귀족들은 이탈리아 10대 소년 소녀 백여 명을 강제로 데려와 ""재미와 게임""을 위해 외딴 빌라에 가둬 놓는다. 권력자들은 매일 어떤 방식으로 성욕을 분출할지 회의하고 그 수위도 점점 높아지는데…",27.736,/muT3F8Jf9jlJecwpZjlhhLYaCUq.jpg,1975-11-22,N/A,116,N/A,살로 소돔의 120일,4819,42845,42846,Alberto Grimaldi,/wWvHu8AQlyc2D5VEEmlrDj4SuQy.jpg,/sXdFKnc4MVhk06CGsF3uCERwo1T.jpg,/r7Zgwxl1w0kb8pB3ZXCVMoXg5n1.jpg
135,N/A,52000000,36,葉問4,"홍콩이 영국으로 넘어가던 시기, 엽문은 불산에서 내려와 홍콩에서 지내고있었다.  정식으로 도장을 차리진 않았지만 그의 주변엔 가르침을 받으려는 제자들이 모여들고,  엽문은 그들과 함께 영춘권을 연마하며 노년을 보낸다.  가족과 제자들을 아끼고 사랑하며, 조용히 살아가고 싶은 엽문.  그러나 그의 주변 인물들에게 얽혀 벌어지는 일들은 그를 결코 평화롭게 놔두지 않는다.",33.646,/rULoS40bBppuMcyr8KE4FHBs3zp.jpg,2019-10-18,N/A,N/A,N/A,엽문4,1341,83633,78110,Wilson Yip,N/A,N/A,N/A
136,N/A,9250000,18,Hundraåringen som klev ut genom fönstret och försvann,"알란’s 10대 폭탄 제조의 달인으로 남다른 능력을 보유.  알란’s 20대 폭탄 실험 중 실수로 이웃 식료품 가게 주인 사망.  위험인물로 분류, 정신병원에 수감되어 생체실험 감행, 남성적 기능(?) 상실.  알란’s 30대 스페인 내전 참전. 폭탄 실험 중 우연히 지나가던 파시스트 프랑코의 목숨을 구하며 그의 최측근으로 영웅 등극.  알란’s 40대  미국 원자폭탄 프로젝트인 맨해튼 프로젝트의 치명적 결함 우연히 해결.  제2차 세계대전을 종결시키며 해리 트루먼 대통령의 수석 과학, 정치 멘토로 활동.  알란’s 50대  미국 CIA요원으로 발탁되어 미국과 러시아의 이중 스파이로 활약.  어쩌다 보니 베를린 장벽 붕괴에 일조…?!  알란’s 100세  생일을 맞아 다시 모험을 떠난 100세 할배. 갱단의 검은 돈을 손에 넣게 되는데…  꽃할배보다 버라이어티하고 보다 능력자인 100세 할배의 모험은 이제 시작이다!",31.851,/laiPG7voey9O2eVHl7eWKAgC8hz.jpg,2013-12-25,N/A,114,"스탈린, 김일성, 아인슈타인의 숨겨진 멘토?! 20세기 역사를 들었다 놨다 ~ 간 큰 할배의 감동과 웃음 폭탄!",창문넘어 도망친 100세 노인,74699,282449,1314260,Felix Herngren,/xEwzTC86KVp8sbwsYZZX2sNTkWR.jpg,/mtWZqyT3QRoJ0nTilg2FDe9cm7G.jpg,/9Bby9yli2rIwQ3ZDoGu1PhSftGG.jpg
137,N/A,19000000,18,Pawn Sacrifice,"6세, 체스 입문  13세, 미국 체스계 제패  15세, 최연소 그랜드 마스터 타이틀 획득  체스 천재 ‘바비 피셔’의 목표는 오직 단 하나 국제무대에서 우승해 세계 정상에 등극하는 것!  이제 챔피언 자리까지 남은 사람은 단 한 명  무패 신화 체스 황제 ‘보리스 스파스키’를 넘어야만 한다!  드디어 전 세계의 시선이 집중된 역사적인 경기가 열리는 날, 마치 제 3차 세계대전을 방불케 하는 긴장감이 도는 무대 위 ‘바비 피셔’의 모습이 보이지 않는데…",25.539,/4Xy5Uh0lfkNLvfYjKvlQxa4lFai.jpg,2015-09-16,5578519,115,"천재 VS 천재     과연, 역사를 뒤흔든 ‘세기의 매치’는 이뤄질 수 있을까?",세기의 매치,2219,4888,133,Edward Zwick,/7Tt7UjlyccQpM6IKqzJI45DYXVR.jpg,/uHHoc7Hf8z4XXxqTbR0lupJy8w.jpg,/n5SrZKEFPjWXRUkGSx0NpBPcovq.jpg
138,N/A,22000000,53,The Nun,루마니아의 젊은 수녀가 자살하는 사건을 의뢰 받아 바티칸에서 파견된 버크 신부와 아이린 수녀가 수녀원을 조사하면서 충격적인 악령의 실체와 만나게 되는 이야기를 그린다.,31.345,/mN226GIDSMhWBpqPJopGlLk3qXn.jpg,2018-09-05,365550119,96,죽을만큼 무섭지만 죽진 않는다,더 넌,87287,527313,76961,Corin Hardy,/fgsHxz21B27hOOqQBiw9L6yWcM7.jpg,/tfKxFPq4lel0bL80H0C6kGYKGEq.jpg,/rcwlgLED9dik5whPUaWTUZy0TiW.jpg
139,N/A,72000000,9648,Signs,"미국 펜실베니아 주 벅스 카운티에 소재한 그래함 헤스(멜 깁슨)의 농장 주택! 집안에서 바라본 창밖 세상에는 평화로운 기운만 가득하다. 그런데 바로 그 때 2층 창문의 투명한 유리가 물결치듯이 잠시 일렁이는 것이 아닌가! 그 유리창을 통해 누가 창밖을 보고 있었던 것일까? 바로 그 날 아침 그래함(멜 깁슨)은 아이들과 애완견의 비명소리에 놀라 잠에서 깨어나 밖으로 달려 나간다. 그리곤 경악을 금치 못한다. 자신의 옥수수 농장에서 이상한 흔적이 발견된 것이다. 그것은 원과 선으로 된 복잡한 패턴의 미스테리 서클(mystery circle)이었다. 그 날 이후 그래함은 미스테리 서클이 무엇을 말하려는 메시지인지, 그리고 그것이 왜 하필 자신의 옥수수 농장에 만들어져 있는 것인지에 관하여 미스테리를 풀어나가는 과정에서 충격적인 존재와 마주치게 된다. 그래함이 목격한 존재는 그 자신뿐만 아니라 동생 메릴(호아킨 피닉스), 아들 모건(로리 컬킨), 어린 딸 보(아비게일 브레슬린)의 인생에도 엄청난 충격과 변화를 초래하게 되는데...!",26.174,/vfToEZ7CPTCOxJBoKGrNv7tdLFE.jpg,2002-08-02,408247917,106,멈추지 않는 의문의 메시지 미스테리 써클... 그 마지막은 무엇인가?,싸인,2461,73421,28042,M. Night Shyamalan,/kormVYncbZMrToXaOV58o74LNIz.jpg,/bxBS9KKhCj5Jkp09GJXQ2T7rGz3.jpg,/ksyOtfDvn3eZZIfEcoRy87YUiwL.jpg
140,N/A,31000000,10751,Oliver & Company,"월트 디즈니의 27번째 만화영화. 이 작품은 흥행면에서 상당히 우수한 성적을 거둔 작품으로서 역시 컴퓨터 그래픽이 많이 개입된 작품입니다. 여기서 컴퓨터 그래픽이라고 하는 것은 컴퓨터가 만든 이미지를 애니메이션에 합성하여 나타나는 것 뿐 아니라, 채색, 셀제작 과정 등에 활용되는 것도 포함하는 것이다. 현대의 인건비 상승이 애니메이션 제작에 압박 요인으로 작용하는 상황에서 이 방법은 제작비를 절감토록 하여 좋은 작품의 개발에 무척 도움을주는 방향으로 작용한다.
   이제 디즈니 스튜디오는 흔들거리던 모습을 차츰 재 정비하는 방향으로 나아가고 있었다. 전작인 의 성공을 통해 제작 능력에 대한 자신감을, 으로서 아직 만화영화의 시장에 충분한 잠재력이 존재하고 있음을 확인하였고, 마침내 오랜만에 흥행의 성공작을 만들어 내었다.
   찰스 디킨스의 소설을 각색하여 뉴욕을 무대로 바꾸엇다. 고아인 고양이 올리버는 맨하탄의 깡패 다져에게 끌려가 소매치기와 어울리는데 그들의 두목은 악당 페긴이다. 부잣집 딸 제니가 올리버를 데려다자기집에서 키우자, 페긴의 한패인 사이크스가 제니와 올리버를 납치하고친구들이 이들을 구출한다.
   페이건은 디킨스의 원작에서 아이들에게 소매치기 훈련을 시키는 것처럼 개들에게 도둑질을 가르치는 사람이다. 이것이 아마도 올리버와 친구들이 올리버 트위스트와 가지는 유일한 공통점일 것이지만, 그것은 큰 문제는 되지 않는다.",23.269,/m54pXsIUy3IJoaGhk3RwKsZQPG8.jpg,1988-11-18,74151346,74,N/A,올리버와 친구들,51750,71791,11159,George Scribner,/7klp2EhVlmogIXLyQsLVFrhdMD3.jpg,/jDLJ1X0YCzTD5Jh5WxfN7wD0pyN.jpg,/9kgZc7BRePE2AHqWgF1DBrggQ8J.jpg
141,N/A,60000000,18,In the Name of the King: A Dungeon Siege Tale,"사랑스런 아내, 아들과 함께 평범한 농부로 사는 파머(제이슨 스타뎀 분)는 어느 날 세상을 지배할 야욕에 찬 마법사 갤리언(레이 리오타 분)이 보낸 크러크 군단들이 마을을 습격하자 가족을 지키기 위해 싸우지만 아들은 죽고 아내는 납치당한다. 정복전쟁에 참가한 탓에 뒤늦게 도착한 왕과 왕의 군대에 불만을 느낀 파머는 콘레드 왕(버트 레이놀즈 분)의 제안을 거절하고 자신의 힘으로 아내를 구하고자 그의 스승인 노릭(론 펄만 분)과 함께 원정대를 만들어 크러그 군단들을 추적한다. 한편 왕은 마법사 갤리언이 크러그들을 조종해서 군대를 만들고 왕의 조카인 듀크 공작을 앞세워 왕국을 차지하려는 계획을 눈치채지만 대규모 전투 중 갤리언에게 독살당하고 왕국은 위기를 맞게 되는데..",26.271,/mMJQwMEJtfsh8GPTiQ40L2MrjCZ.jpg,2007-11-29,N/A,127,"가장 위대하고 가장 막강한 영웅의 탄생, 왕국의 운명이 그에게 달렸다!",왕의 이름으로,976,655,11477,Uwe Boll,/u14b6vdFieOm9OXGa49c7n5gmQS.jpg,/gcLw8wpSXKnkQVNBxg2BZjHl1at.jpg,/47DJFwE1CN1wAgEBLpOH17GdklG.jpg
142,N/A,N/A,18,The Man Who Knew Infinity,머릿속에 그려지는 수많은 공식들을 세상 밖으로 펼치고 싶었던 인도 빈민가의 수학 천재 ‘라마누잔’.  그의 천재성을 알아본 영국 왕립학회의 괴짜 수학자 ‘하디 교수’는  엄격한 학교의 반대를 무릅쓰고 케임브리지 대학으로 ‘라마누잔’을 불러들인다.  성격도 가치관도 신앙심도 다르지만 수학에 대한 뜨거운 열정으로 함께한 두 사람은  모두가 불가능이라 여긴 위대한 공식을 세상에 증명하기 위해 무한대로의 여정을 떠나는데…  역사상 가장 지적인 브로맨스가 시작된다!,26.968,/8IEULqgLdni0Yqp4IWGctBcXPXb.jpg,2016-04-08,11472454,108,"하늘이 내린 수학 천재, 그를 알아준 단 한 사람 기적을 증명한 두 남자의 특별한 우정!",무한대를 본 남자,76788,16940,13014,Matt Brown,/A5ACRzx0eNuKI8qISuOBFWICFE4.jpg,/cUDfYBsmB02ho6qI2joJVQ7we8p.jpg,/yunTtweAPGJSPb7Nr8kEW0oIkaQ.jpg
143,N/A,20000000,10749,Endless Love,"졸업식 날 운명적으로 마주한 제이드(가브리엘라 와일드)와 데이빗(알렉스 페티퍼)은 서로를 향한 강한 끌림을 느낀다. 제이드는 데이빗을 통해 그 동안 느껴보지 못한 자유로움과 가슴 뛰는 사랑에 거침없이 빠져들고, 데이빗은 순수한 제이드에게 매료되어 그녀에게 진정한 사랑이 무엇인지 알게 해 준다.  한편, 제이드의 아버지는 모든 것을 내던지고 빠져드는 이들의 사랑을 경계하고,  데이빗과 함께하는 바로 이 순간의 사랑을 놓고 싶지 않은 제이드는 중대한 결심을 하게 되는데...",24.26,/asqHruzZCfAawEfjbVR6UezIzZc.jpg,2014-02-12,34077920,103,"사랑이 전부인 지금, 나는 순수와 작별한다.",엔들리스 러브,61363,1014932,21089,Shana Feste,/bYbNcN0l3131wmdkMfnUE30SzLI.jpg,/bjfbRKvXv9KiMTXz3xt8BpB7ikA.jpg,/k00yT59cD984Ec11o1IPKXG8cHx.jpg
144,N/A,11000000,9648,Le passé,"아마드는 4년 째 별거 중인 마리와 이혼하기 위해 파리로 향한다. 오랜만에 찾아 간 그녀의 집에는 전남편 사이에서 낳은 두 명의 딸과, 곧 마리와 결혼하는 사미르, 그리고 사미르의 불만투성이 아들이 있다. 한편, 아마드는 자꾸만 엇나가는 큰 딸 루시에게 사미르의 전 부인이 현재 혼수 상태이며, 그것이 엄마 마리 때문이라는 충격적인 이야기를 듣게 되는데...",23.942,/bktzgmO8KzdzKAXZNwweN2JdY4R.jpg,2013-05-17,10631747,130,"모든 것이 끝난 것 같아도, 기억은 흔적을 남긴다...",아무도 머물지 않았다,82923,81051,1104854,Asghar Farhadi,/ewD6siG8B0zKkhC1jdnLxtMoCC9.jpg,/rcrZXlY6Cv6W4qod5wXpouA8dHx.jpg,/v0n05pokVhg5mVIzD9eL8pFmy2e.jpg
145,N/A,1900000,878,Forbidden Planet,"AD 2257년. 지구에서 온 과학자 그룹이 사전답사를 위해 한 행성에 도착한다. 이 과학자 그룹이 타고온 우주선의 선장 코멘드는 이 행성을 지배하는 몰비우스라는 성지를 만난다. 박사는 시키는 일을 무엇이든 해내는 ""로비""라는 신기하고 귀여운 로보트와 앨테라라는 매력적인 딸이 있다. 그녀는 눈부신 아름다움을지닌채 아버지가 이룩한 왕국에서만 살았기 때문에 남자의 존재는 전혀 모르고 있다가 이 행성에 방문한 코멘드에게 첫눈에 반하고 사랑에 빠지는데.",30.482,/qdH1Fm5vl1DAjXNHPmRZ4yEiUgM.jpg,1956-03-15,3250000,98,N/A,금지된 행성,12308,12309,7633,Fred M. Wilcox,/9rrZp2Je3hZjE8Q9m3Ju84eFjDy.jpg,/1oji60IBrvtakrmmt6bv4lpwjHt.jpg,/rHzVbibGGycUelThXx0swbSuyez.jpg
146,N/A,3300000,10402,Whiplash,"최고의 드러머가 되기 위해서라면 무엇이든 할 각오가 되어있는 음악대학 신입생 앤드류는 아무도 없는 지하실에서 혼자 드럼을 연습하던 중 우연한 기회로 누구든지 성공으로 이끄는 최고의 실력자이지만, 또한 동시에 최악의 폭군인 플렛처 교수에게 발탁되어 그의 밴드에 들어가게 된다. 설레는 마음으로 참가한 첫 연습에서, 그는 플렛처 교수의 진짜 얼굴을 마주치게 된다. 폭언과 학대 속에 좌절과 성취를 동시에 안겨주는 플렛처의 지독한 교육방식은 천재가 되길 갈망하는 앤드류의 집착을 끌어내며 그를 점점 광기로 몰아넣는데...",31.458,/8PEvm9MP8JVjQxl5puVTRthfJAV.jpg,2014-10-10,13092000,107,천재를 갈망하는 광기가 폭발한다,위플래쉬,996701,18999,781,Jasmine McGlade,/6bbZ6XyvgfjhQwbplnUh1LSj1ky.jpg,/qU8IpZlBNsTHNcApMHjtoQb4wp2.jpg,/pLdMTlzAZWYdLCBk3lRl2edWoux.jpg
147,N/A,N/A,12,Last Knights,사상 최고의 실력으로 전설이 된 최강 부대 제 7기사단과 대장 ‘레이든’(클라이브 오웬). 그는 절대 권력의 횡포로 힘없는 이들이 고통 받는 세상을 바로 잡으려는 ‘바톡’(모건 프리먼) 영주의 뜻에 따라 정의와 신념을 지키기 위한 반격을 결심하는데…,23.17,/lw3uiYfQJhgvwp9eujvwVCmX18h.jpg,2015-04-03,3643591,115,"타락한 왕국, 절대 권력에 맞선 최후의 전투가 시작된다!",제 7기사단,2296,192,76547,Kazuaki Kiriya,/htDjxVDvVbia575PIIrCtjtRuni.jpg,/gItSGA2Zh4UI69ogFrY7U6ZTJMo.jpg,/sxlL4oPiOOEHjQ95FCK2E8p2dzf.jpg
148,N/A,6000000,80,Veronica Mars,N/A,24.216,/nS3L07mQfcNJcisLEKgi8fWoBS1.jpg,2014-03-13,3485127,107,N/A,베로니카 마스,40462,158095,15029,Rob Thomas,/s8891Ox7a5O7Gk0SbPUOY6EKiGN.jpg,/afbO5aJLqx8thwfvXH7jAz12er7.jpg,/rO75nODBBmJx4u5ZRy2BsGFgbO7.jpg
149,N/A,5000000,53,The Belko Experiment,"80여명의 미국인들이 콜롬비아 보고타의 고층 건물에 갇혀, 건물의 사내방송을 통해 살인 게임을 수행하라는 명령을 받는다.",25.116,/faJK0dP3S92kQoKtO4LZMjy41kf.jpg,2016-03-17,10166820,89,N/A,더 벨코 익스페리먼트,17487,3417,1371297,James Gunn,/7pMlmyqitl0nqpEGOL3v8dEbu2K.jpg,/5p7C6TbDozQgKzTnj1tTkqgjzCM.jpg,/oRojrPEHdq1hQRyYZguPZWv97gu.jpg
150,N/A,N/A,80,I Spit on Your Grave 2,"모델을 꿈꾸는 케이티는 고액의 프로필 사진 촬영 비에 낙심하고 있던 중, 무료로 사진을 촬영해 준다는 전단지를 발견하고 스튜디오를 찾아가 촬영을 하지만 사진 작가 ‘이반’이 노출을 요구하자 거절하고 집으로 돌아온다. 그녀에게 한 눈에 반한 사진 작가의 동생 ‘조지’는 원본 프로필 사진을 전해주러 왔다며 그녀의 집에 찾아와 그녀를 겁탈한다. 뒤처리를 하기 위해 달려온 형 ‘이반’과 ‘닉’은 그녀를 상자 속에 넣어 자신들의 지하 창고로 데려가 더욱 잔인한 폭행과 치욕스러운 일들을 행한다. 죽음의 문턱에서 가까스로 목숨을 건지게 된 그녀는 그들에게 복수를 하기로 결심 하는데…",23.702,/apqskWq1K8ShQr4kknh4hFy1MmN.jpg,2013-08-25,N/A,106,N/A,네 무덤에 침을 뱉어라 2,1154842,97430,586060,Steven R. Monroe,/4u4Q70Wvdi6FHNUtsC3BFhR4FZd.jpg,/6TD67XbLc4bwGbDaQg5RkCtBx9O.jpg,/lo5ILLHprdLKHPWbsWYN63YK28L.jpg
151,N/A,50000000,10752,Free State of Jones,"남북전쟁이 한창이던 어느 날 남부군의 뉴튼(매튜 맥커너히)은 지주들의 배만 불리는 전쟁에 회의를 느끼고, 집으로 탈영을 하게 된다. 하지만 고향의 실정은 여전히 남부군의 약탈로 인해 참혹한 실정이었고, 뉴튼은 한 농가가 약탈 당하는 것을 본 후 그들에게 대항을 결정하게 된다.  탈영병이던 그의 행동은 곧바로 군의 추격을 불러왔고, 뉴튼은 인근 늪지대로 피해 다른 흑인 탈주자들과 함께 생활을 하게된다. 그러다가 점점 뉴튼이 있는 캠프는 탈영병들과 남부군에 저항하는 사람들로 가득차게 되고, 어느 덧 숫자는 100여명에 육박하게 된다.  그들의 행동을 지켜보던 남부군은 그들이 다시 돌아온다면 정착금을 지원할 것을 약속하며 회유를 하게 되지만, 정작 그들은 캠프에서 돌아온 사람들을 교수형에 처하고 만다. 화가난 캠프인들은 드디어 봉기를 했고, 그들의 행동은 미시시피 주의 절반 가량을 점령하게 된다. 드디어 사태가 심각하다는 것을 안 남부군은 1000명의 대규모 사단을 미시시피로 파견하게 되는데...",24.737,/xykvliwMEYWCSKWIfTKZ8D3YVLe.jpg,2016-06-24,25035950,139,한 남자의 자유를 찾기 위한 위대한 희생!,프리스테이트,10297,1216606,932967,Gary Ross,/zgo0s1fmBCWUweNrCVIK1dZEOJ6.jpg,/tT5kI56NSqR31kIwCZ49uSIenSk.jpg,/rrs2R6yMb79BzO6pRgSWm2gKYoh.jpg
152,N/A,19500000,53,Secret in Their Eyes,LA 지방검사실에 파견된 FBI 수사관 레이는 파트너 제스의 10대 딸이 잔인하게 살해되자 연방 검사와 팀을 이뤄 살인범을 잡으려고 합니다. 하지만 살인범이 진행중인 테러 수사와 관련하여 보호를 받는다는 사실을 알며 수사는 암초에 부딪치는데...,23.932,/7iNy9PpbLM9FgzXLa1ipeTbS5CR.jpg,2015-10-14,34854990,111,"쓰레기통에서 발견된 시신, 사라진 범인, 미제 종결된 사건. “13년 전, 친구의 딸을 살해한 그놈이 다시 나타났다”",시크릿 인 데어 아이즈,5294,2227,1204,Billy Ray,/73FqG8LVwpiILswH54YBqyMstlc.jpg,/dPquRS3wL0R9cHNuAAkqncmeg0.jpg,/5cIRvFGQacShnTaLVwrX87MRkzE.jpg
153,N/A,28000000,10749,Aladdin,"원숭이 아부와 함께 살아가는 아그라바의 좀도둑 알라딘은 어느 날 궁궐을 탈출한 술탄의 딸 자스민에게 한눈에 반한다. 술탄의 자리를 노리는 사악한 마법사 자파는 알라딘을 눈여겨보고 그에게 마법의 램프를 가져다주면 부자로 만들어 주겠다고 말한다. 동굴에 들어가서 램프를 찾던 알라딘은 도중에 동굴이 무너지는 바람에 갇히게 된다.  위기에 빠진 알라딘은 램프의 요정 지니와 마법 양탄자의 도움으로 동굴에서 탈출한다. 지니의 주인이 된 알라딘은 지니를 램프에서 구해주겠다고 약속하고, 지니의 힘을 빌어 왕자로 변신해 자스민에게 청혼하기 위해 아그라바로 돌아오는데...",31.097,/dNqpfCTQjUDRDGsaaAP6kdVAS8M.jpg,1992-11-25,504050219,90,"오늘, 당신의 꿈이 이루어집니다",알라딘,15827,2157,15829,Ron Clements,/oZN5w508NSlrmcMql1wohhsQGIg.jpg,/kQFC7dD9bKUffp9RH0X1UAmMbGo.jpg,/toPEmFIckgRSPd40g6OLv3LWPtp.jpg
154,N/A,170000000,878,Captain America: The Winter Soldier,스티브 로저스(크리스 에반스)는 외계의 뉴욕 침공 사건이 있은 뒤 워싱턴에서 쉴드 요원으로 살아가고 있다. 납치된 쉴드의 함선을 구출하는 작전을 펼치던 중 스티브는 닉 퓨리 국장(새뮤얼 L. 잭슨)과 블랙 위도우(스칼렛 요한슨)가 쉴드의 정보를 무단으로 수집하고 있다는 것을 알게 된다. 그리고 얼마 뒤 닉 퓨리는 윈터 솔져(세바스천 스탠)의 공격으로 눈을 감는다. 블랙 위도우와 함께 닉 퓨리가 남긴 USB를 분석하며 진실을 추적하던 스티브는 적이 쉴드 내부에 존재한다는 사실을 알게 된다. 설상가상 윈터 솔져가 캡틴 아메리카의 단짝 친구 버키라는 사실이 드러나는데...,26.533,/qNjWlrKWS9pUNNyT4Syi1WMRNIo.jpg,2014-03-20,714766572,136,쉴드가 뚫렸다! 어벤져스를 향한 최악의 위기!,캡틴 아메리카: 윈터 솔져,16828,2231,1245,Joe Russo,/4qfXT9BtxeFuamR4F49m2mpKQI1.jpg,/uOHtJgNiXuAsZoZbHm5OjSbOh5a.jpg,/hXpWqy7E0Lq6sn79i1j0JRZif9c.jpg
155,N/A,8000000,35,Les Triplettes de Belleville,"어른이 된 그는 [투르 드 프랑스]경기에 참여하지만 대회 도중 납치를 당한다. 강아지와 함께 사라잔 손자를 찾아나선 그의 할머니, 마담 수자. 프랑스 마피아의 근거지인 낯선 항구도시 ‘벨빌’에 도착한 그녀는 그곳에서 젊은 시절에는 배우였고 현재는 재즈그룹으로 활동하는 세 쌍둥이 자매를 만나는데…",21.664,/zumuUa5xcXJeUPz0oYiTgkznIZ8.jpg,2003-06-11,1477676,80,자전거를 타는 것이 유일한 행복인 외로운 소년 챔피온.,벨빌의 세 쌍둥이,58416,58417,58418,Sylvain Chomet,/qBRwRxhUszKvcHQxMiimuax6U2e.jpg,/iGGOn3d3pQB5gBY7PvqN40ZYzWx.jpg,/oEWs0uDAK9IDm3z4VD0YUuyQEUs.jpg
156,N/A,165000000,10751,How to Train Your Dragon,"바이킹의 세계, 절대 친구가 될 수 없는 둘이 만났다?  용맹한 바이킹과 사나운 드래곤들의 싸움이 끊이지 않는 버크섬.  바이킹 족장의 아들 ‘히컵’은 드래곤 사냥에 소질 없는 마을의 사고뭉치. 어느날 그는 부상 당한 드래곤 ‘투슬리스’를 구하게 되고, 아무도 몰래 그를 돌본다. 서로를 알아가며, 드래곤들의 친구가 된 ‘히컵’. 그들과의 새로운 생활을 만끽하던 ‘히컵’은 드래곤들의 위험한 비밀을 알게 되는데…  불멸의 드래곤과 바이킹족 이단아의 만남!  2010년 5월, 그들의 스펙터클한 모험이 시작된다!",30.316,/5JtTkNwOeztwfCPv965e9bZi6G3.jpg,2010-03-10,494878759,100,우리의 모험은 지금부터다!,드래곤 길들이기,449,17276,24264,Bonnie Arnold,/mxPvA8cj0Eqa1A13DcT5NzFq7Ta.jpg,/kQ0Sq4ihGmBq6r00S7KmhtOyO6Z.jpg,/dEhTNJ7RoFC5C72jFVXoVLYBeb4.jpg
157,N/A,38000000,878,Overlord,"2차 세계 대전 D-Day  전날 밤, 공수부대가 노르망디 외곽의 작은 마을에서 독일 무선탑을 파괴하라는 임무수행 중에 비행기가 추락한다.  결국 목표에 도착을 했지만 공수부대는 나찌 군인들과 싸우는 것 외에도 나치의 비밀 실험체인 무시무시하고 피비린내 나는 폭력적인 동물들과 싸워야한다.",30.2,/2Sfo3O54kTAAnBfZaCXrwimORSo.jpg,2018-11-01,41657844,110,N/A,오버로드,1607522,986808,1700784,Julius Avery,/sHNC8hjAu4ZKXYhG3cp8ghRZ02B.jpg,/iEQgMiqCIzS1osIuafgctvluGj5.jpg,/vAIILK0yn4ZV9LecWcMLAoAjzmt.jpg
158,N/A,15000000,27,Scouts Guide to the Zombie Apocalypse,어린 시절부터 6년간 스카우트 생활을 해온 벤(타이 쉐리던)과 카터(로건 밀러)는 카터의 누나 켄들(할스톤 세이지)이 참여하는 비밀파티에 초대를 받는다. 초대를 받은 날 파티에 참여하기 위해 스카우트 캠프를 빠져나온 벤과 카터. 하지만 파티 전 평소 호기심을 갖고 있던 스트립클럽의 문지기가 없은 것을 본 카터는 몰래 클럽에 들어갔다가 좀비들의 공격을 받는다.  뜬금없는 좀비들의 공격. 그곳에서 데니스(사라 두몬트)를 만난 벤과 카터는 비밀파티가 열리는 장소로 켄들을 구하러 가는데...,25.164,/3wHxtemithpFQiB7ffa50ZKI6bz.jpg,2015-10-23,14860766,93,N/A,좀비 서바이벌 가이드,1034681,116088,1326885,Christopher Landon,/m0VRjrm2WzEg6lPWHS9Y2khsBbr.jpg,/8lniDZZweDNzCAY68xlSqPZ1tpD.jpg,/g9pgzOel4BzrHSSjezByWWTRZBs.jpg
